<?xml version="1.0" encoding="UTF-8"?>
<!DOCTYPE Bailes SYSTEM "t5Ej5.dtd">

<Bailes>

 <baile id="1">
   <nombre>tango</nombre>
   <precio cuota="mensual" moneda="euro">27</precio>
   <plazas>20</plazas>
   <comienzo>1/1/2011</comienzo>
   <fin>1/2/2011</fin>
   <profesor>Roberto García</profesor>
   <sala>1</sala>
 </baile>
 
 
 <baile id="2">
   <nombre>Cha-cha-cha</nombre>
   <precio cuota="semanal" moneda="euro">80</precio>
   <plazas>18</plazas>
   <comienzo>1/2/2011</comienzo>
   <fin>31/7/2011</fin>
   <profesor>Miriam Gutierrez</profesor>
   <sala>1</sala>
 </baile>
 
</Bailes> 
